[
  {
    "severity": "warning",
    "code": "UnsupportedCard",
    "path": "/content/0",
    "message": "ADF card without a URL was rendered as text.",
    "fallback": "text"
  },
  {
    "severity": "warning",
    "code": "UnsupportedCard",
    "path": "/content/1",
    "message": "ADF card without a URL was rendered as text.",
    "fallback": "text"
  },
  {
    "severity": "warning",
    "code": "UnsupportedCard",
    "path": "/content/2/content/1",
    "message": "ADF card without a URL was rendered as text.",
    "fallback": "text"
  }
]
