[
  {
    "severity": "warning",
    "code": "UnsupportedExpand",
    "path": "/content/0",
    "message": "ADF expand was flattened into Markdown content.",
    "fallback": "flatten"
  },
  {
    "severity": "warning",
    "code": "UnsupportedExpand",
    "path": "/content/0/content/2",
    "message": "ADF expand was flattened into Markdown content.",
    "fallback": "flatten"
  }
]
