[
  {
    "severity": "warning",
    "code": "UnsupportedMedia",
    "path": "/content/0/content/0",
    "message": "ADF media was rendered as a Markdown link fallback.",
    "fallback": "link"
  },
  {
    "severity": "warning",
    "code": "UnsupportedMedia",
    "path": "/content/0/content/1",
    "message": "ADF media was rendered as a Markdown link fallback.",
    "fallback": "link"
  }
]
